Ідентифікатор лота,Лот,Процедура закупівлі,Дата оголошення лота,Організатор,Класифікація CPV
UA-2099-01-10-000001-a-L1,Synthetic procurement lot 1 for translation-related services,open_tender,2099-01-10,Synthetic Municipal Language Services Office | 10000001,79530000-8
UA-2099-02-10-000002-a-L1,Synthetic procurement lot 2 for interpretation-related services,belowThreshold,2099-02-10,Demo Administrative Service Center | 10000002,79540000-1
UA-2099-03-10-000003-a-L1,Synthetic procurement lot 3 for translation-related services,open_tender,2099-03-10,Fictional Training Analytics Department | 10000003,79530000-8
UA-2099-04-10-000004-a-L1,Synthetic procurement lot 4 for interpretation-related services,belowThreshold,2099-04-10,Sample Public Procurement Unit | 10000004,79540000-1
UA-2099-05-10-000005-a-L1,Synthetic procurement lot 5 for translation-related services,open_tender,2099-05-10,Mock International Cooperation Department | 10000005,79530000-8
UA-2099-06-10-000006-a-L1,Synthetic procurement lot 6 for interpretation-related services,belowThreshold,2099-06-10,Test Public Services Agency | 10000006,79540000-1
UA-2099-07-10-000007-a-L1,Synthetic procurement lot 7 for translation-related services,open_tender,2099-07-10,Demo Regional Development Office | 10000007,79530000-8
UA-2099-08-10-000008-a-L1,Synthetic procurement lot 8 for interpretation-related services,belowThreshold,2099-08-10,Synthetic Professional Training Center | 10000008,79540000-1
